{
  "$schema": "https://json-schema.org/draft/2020-12/schema",
  "$id": "comparison-table.schema.json",
  "title": "Per-role comparison table",
  "description": "Aggregates eval result rows (result-row.schema.json, plan §8 field list) into one table per role, with one cell per (model, driver, variant) identity. Axis 1 (ADR-0001, revised 2026-09-14) populates cells with driver \"ai-sdk\" across models; axis 2 populates cells with the fixed served GLM model id (glm-5.3-flash) across all four drivers. All model ids in cells are served ids per the served-id decision (2026-09-14).",
  "type": "object",
  "additionalProperties": false,
  "required": ["role", "suite", "cells"],
  "allOf": [
    {
      "description": "Workspace binding is a fixer-worker concern; classifier cells must not carry a fixer-only validity marker.",
      "if": {
        "properties": { "role": { "const": "review-classifier" } },
        "required": ["role"]
      },
      "then": {
        "properties": {
          "cells": {
            "items": { "not": { "required": ["invalid"] } }
          }
        }
      }
    }
  ],
  "properties": {
    "role": {
      "type": "string",
      "enum": ["fixer-worker", "review-classifier"],
      "description": "The plan §9 role whose result rows this table aggregates."
    },
    "suite": {
      "type": "string",
      "minLength": 1,
      "description": "Name of the task suite the aggregated rows came from (the `name` field of a suite.schema.json document)."
    },
    "generatedAt": {
      "type": "string",
      "format": "date-time",
      "description": "When the table was generated (RFC 3339 date-time)."
    },
    "comparisons": {
      "type": "array",
      "description": "W6.5: paired case-clustered comparisons over repeated rows. Absent on single-run historical tables.",
      "items": {
        "type": "object",
        "additionalProperties": false,
        "required": ["baseline", "candidate", "cases", "repeatsPerCase", "delta", "standardError", "confidenceInterval", "minimumDetectableEffect", "noiseBand", "interpretation", "coverageParity"],
        "properties": {
          "baseline": { "$ref": "#/$defs/cellIdentity" },
          "candidate": { "$ref": "#/$defs/cellIdentity" },
          "cases": { "type": "integer", "minimum": 2 },
          "repeatsPerCase": { "type": "integer", "minimum": 2 },
          "delta": { "type": "number", "minimum": -1, "maximum": 1 },
          "standardError": { "type": "number", "minimum": 0 },
          "confidenceInterval": {
            "type": "object", "additionalProperties": false,
            "required": ["lower", "upper", "confidence"],
            "properties": {
              "lower": { "type": "number" },
              "upper": { "type": "number" },
              "confidence": { "const": 0.95 }
            }
          },
          "minimumDetectableEffect": { "type": "number", "minimum": 0 },
          "noiseBand": { "type": "number", "minimum": 0 },
          "interpretation": { "enum": ["noise", "signal", "descriptive"] },
          "coverageParity": { "type": "boolean" }
        }
      }
    },
    "cells": {
      "type": "array",
      "minItems": 0,
      "description": "One cell per (model, driver, variant) identity with at least one result row; an empty suite yields an empty-but-valid table (cells: []) — the J2 runner's conformance property.",
      "items": {
        "type": "object",
        "additionalProperties": false,
        "required": [
          "model",
          "driver",
          "runs",
          "passed",
          "total",
          "score",
          "costUSD",
          "wallTimeMs",
          "tokens"
        ],
        "properties": {
          "model": {
            "type": "string",
            "minLength": 1,
            "description": "Served model id of the rows in this cell (served-id decision 2026-09-14)."
          },
          "driver": {
            "type": "string",
            "enum": ["ai-sdk", "claude-agent", "subprocess", "acp"],
            "description": "The toolkit driver lane of the rows in this cell (ADR-0001)."
          },
          "runs": {
            "type": "integer",
            "minimum": 1,
            "description": "Number of result rows aggregated into this cell."
          },
          "passed": {
            "type": "integer",
            "minimum": 0,
            "description": "Scoring probes passed, summed over the cell's rows."
          },
          "total": {
            "type": "integer",
            "minimum": 1,
            "description": "Scoring probes total, summed over the cell's rows (each row requires outcome.total >= 1, so an aggregate of 0 is unreachable)."
          },
          "score": {
            "type": "number",
            "minimum": 0,
            "maximum": 1,
            "description": "Aggregate score for the cell: passed/total."
          },
          "invalid": {
            "type": "string",
            "enum": ["workspace-unbound"],
            "description": "P5 validity marker propagated from the contributing rows. Scores are retained unchanged but must not be published as a valid model result."
          },
          "costUSD": {
            "type": ["number", "null"],
            "minimum": 0,
            "description": "Aggregate cost in USD over the cell's runs, or null when the lane is subscription-metered and has no per-invocation USD (DD-9, 2026-09-14)."
          },
          "costBasis": {
            "type": "string",
            "enum": ["billed", "modeled"],
            "description": "Optional basis of a non-null costUSD, mirroring the toolkit's WorkerResult.costBasis, so a modeled number is never silently reported as actual spend; forbidden when costUSD is null (DD-9)."
          },
          "wallTimeMs": {
            "type": "integer",
            "minimum": 0,
            "description": "Wall-clock duration in milliseconds, summed over the cell's runs."
          },
          "tokens": {
            "type": "object",
            "additionalProperties": false,
            "required": ["input", "output"],
            "description": "Token usage summed over the cell's runs, same shape as a result row's tokens (ADR-0001 usage shape).",
            "properties": {
              "input": {
                "type": "integer",
                "minimum": 0
              },
              "output": {
                "type": "integer",
                "minimum": 0
              },
              "cacheRead": {
                "type": "integer",
                "minimum": 0
              },
              "cacheWrite": {
                "type": "integer",
                "minimum": 0
              },
              "reasoning": {
                "type": "integer",
                "minimum": 0
              }
            }
          },
          "byVerdict": {
            "type": "object",
            "description": "VERSIONED ADDITIVE change F4 (2026-09-21): per-verdict confusion counts, computed from the rows' probes[] (review-classifier cells only; absent on fixer cells and on all old tables by design). Exactly the five classifyThreads verdict keys; each value carries the expected count, the correct count (observed === expected), and the predicted buckets for in-vocabulary observed verdicts (a null or out-of-vocabulary observed is a miss with no predicted bucket).",
            "propertyNames": {
              "enum": ["actionable", "responded", "resolved", "blocked", "skip"]
            },
            "minProperties": 5,
            "maxProperties": 5,
            "additionalProperties": {
              "type": "object",
              "additionalProperties": false,
              "required": ["expected", "correct", "predicted"],
              "properties": {
                "expected": {
                  "type": "integer",
                  "minimum": 0,
                  "description": "Rows whose probe expected this verdict."
                },
                "correct": {
                  "type": "integer",
                  "minimum": 0,
                  "description": "Rows whose observed verdict equaled the expected verdict."
                },
                "predicted": {
                  "type": "object",
                  "description": "Counts per observed (predicted) verdict among rows expecting this verdict's key — in-vocabulary observed verdicts only.",
                  "propertyNames": {
                    "enum": ["actionable", "responded", "resolved", "blocked", "skip"]
                  },
                  "additionalProperties": {
                    "type": "integer",
                    "minimum": 0
                  }
                }
              }
            }
          },
          "macroF1": {
            "type": "number",
            "minimum": 0,
            "maximum": 1,
            "description": "VERSIONED ADDITIVE change F4 (2026-09-21): mean of the five per-verdict F1 scores derived from byVerdict (per-verdict F1 = 2TP/(2TP+FP+FN), 0 when the denominator is 0). Absent wherever byVerdict is absent."
          },
          "fpRate": {
            "type": "number",
            "minimum": 0,
            "maximum": 1,
            "description": "VERSIONED ADDITIVE change F4 (2026-09-21): fraction of the cell's suspicious-benign rows (row suspiciousBenign === true) whose probe OBSERVED actionable — i.e. the classifier cried wolf on adjudicated-benign content. A benign row missed with any other observed verdict (or a null observed) is a miss, not a false positive. Omitted with fpN when the subset is empty."
          },
          "fpN": {
            "type": "integer",
            "minimum": 0,
            "description": "VERSIONED ADDITIVE change F4 (2026-09-21): denominator of fpRate — the count of suspicious-benign rows in this cell. Omitted when zero."
          },
          "variant": {
            "type": "string",
            "minLength": 1,
            "pattern": "^[A-Za-z0-9][A-Za-z0-9._-]*$",
            "description": "VERSIONED ADDITIVE change F6 (2026-09-21): the prompt/tool-surface bundle id that distinguishes this cell. Omitted for the default posture, so pre-F6 tables and default cells keep their shape. Cells are unique on (model, driver, variant)."
          },
          "scoreCI": {
            "type": "object",
            "additionalProperties": false,
            "required": ["lower", "upper", "confidence"],
            "description": "VERSIONED ADDITIVE change F6 (2026-09-21): Wilson score interval for the cell's score at 95% confidence, emitted only when the cell's probe total n >= 30 (below that the interval is too wide to be evidence). Absent on old tables and on small-n cells.",
            "properties": {
              "lower": { "type": "number", "minimum": 0, "maximum": 1 },
              "upper": { "type": "number", "minimum": 0, "maximum": 1 },
              "confidence": { "type": "number", "minimum": 0, "maximum": 1 }
            }
          },
          "expectedCases": {
            "type": "integer",
            "minimum": 1,
            "description": "VERSIONED ADDITIVE change W6.2 (2026-09-25): the declared case count of the suite this cell aggregated — the coverage denominator. It includes cases the run budget gated before dispatch (which have no rows), so coverage is measurable wherever the cases went. Emitted together with coveredCases and coverage whenever the cell's rows carry expectedCases; absent on all pre-W6.2 tables, so old tables keep their exact shape. The arithmetic invariants (coveredCases <= expectedCases, coverage = coveredCases/expectedCases) are enforced by the aggregator, not this schema."
          },
          "coveredCases": {
            "type": "integer",
            "minimum": 0,
            "description": "VERSIONED ADDITIVE change W6.2 (2026-09-25): the count of DISTINCT cases whose row in this cell is complete evidence. A row stopped on the case budget (stopCause 'budget') is real evidence of a partial run but does not count as covered — a budget stop breaks coverage parity (RS-9 §1.3). Emitted together with expectedCases and coverage."
          },
          "coverage": {
            "type": "number",
            "minimum": 0,
            "maximum": 1,
            "description": "VERSIONED ADDITIVE change W6.2 (2026-09-25): coveredCases/expectedCases — the fraction of the suite's cases this cell holds complete evidence for. A comparison between two cells may be labelled anything stronger than descriptive only when BOTH cells sit at coverage 1 (RS-9 §1.3); below parity, tables must say 'descriptive — coverage a/n vs b/n'. Emitted together with expectedCases and coveredCases."
          },
          "budgetStops": {
            "type": "integer",
            "minimum": 0,
            "description": "VERSIONED ADDITIVE change W6.2 (2026-09-25): contributing rows stopped on the case budget (row stopCause 'budget') — the cell-grain tally of the row-level stopCause column. These rows count in runs and total (the case ran and its probes were configured) but not in coveredCases. Omitted when zero, so clean cells keep their shape."
          }
        },
        "dependentRequired": {
          "byVerdict": ["macroF1"],
          "macroF1": ["byVerdict"],
          "fpRate": ["fpN"],
          "fpN": ["fpRate"],
          "expectedCases": ["coveredCases", "coverage"],
          "coveredCases": ["expectedCases", "coverage"],
          "coverage": ["expectedCases", "coveredCases"]
        },
        "allOf": [
          {
            "if": {
              "properties": { "costUSD": { "const": null } },
              "required": ["costUSD"]
            },
            "then": { "not": { "required": ["costBasis"] } }
          },
          {
            "description": "ADR-0001 eval axes enforced per cell (revised 2026-09-14): axis 1 — models vary on the ai-sdk driver; axis 2 — drivers vary on the fixed GLM served id glm-5.3-flash (served-id decision 2026-09-14). A cell on any non-ai-sdk driver must therefore carry exactly the fixed GLM served id.",
            "if": {
              "properties": { "driver": { "const": "ai-sdk" } },
              "required": ["driver"]
            },
            "then": {},
            "else": {
              "properties": { "model": { "const": "glm-5.3-flash" } }
            }
          }
        ]
      }
    }
  },
  "$defs": {
    "cellIdentity": {
      "type": "object", "additionalProperties": false,
      "required": ["model", "driver"],
      "properties": {
        "model": { "type": "string", "minLength": 1 },
        "driver": { "enum": ["ai-sdk", "claude-agent", "subprocess", "acp"] },
        "variant": { "type": "string", "minLength": 1 }
      }
    }
  }
}
