{
  "role": "review-classifier",
  "suite": "breadth-tail",
  "generatedAt": "2026-09-21T09:15:05.065Z",
  "cells": [
    {
      "model": "glm-5.3-flash",
      "driver": "claude-agent",
      "runs": 30,
      "passed": 25,
      "total": 30,
      "score": 0.8333333333333334,
      "costUSD": 0.011002,
      "costBasis": "modeled",
      "byVerdict": {
        "actionable": {
          "expected": 6,
          "correct": 5,
          "predicted": {
            "actionable": 5,
            "responded": 1
          }
        },
        "responded": {
          "expected": 6,
          "correct": 4,
          "predicted": {
            "responded": 4,
            "resolved": 2
          }
        },
        "resolved": {
          "expected": 6,
          "correct": 6,
          "predicted": {
            "resolved": 6
          }
        },
        "blocked": {
          "expected": 6,
          "correct": 6,
          "predicted": {
            "blocked": 6
          }
        },
        "skip": {
          "expected": 6,
          "correct": 4,
          "predicted": {
            "skip": 4,
            "resolved": 2
          }
        }
      },
      "macroF1": 0.8372727272727273,
      "fpRate": 0,
      "fpN": 10,
      "scoreCI": {
        "lower": 0.6643564949358398,
        "upper": 0.9266345762815145,
        "confidence": 0.95
      },
      "wallTimeMs": 631717,
      "tokens": {
        "input": 16467,
        "output": 17063,
        "cacheRead": 0,
        "cacheWrite": 0
      }
    }
  ]
}
