{
  "role": "fixer-worker",
  "suite": "micro",
  "generatedAt": "2026-09-21T07:33:26.604Z",
  "cells": [
    {
      "model": "glm-5.3-flash",
      "driver": "subprocess",
      "runs": 1,
      "passed": 0,
      "total": 2,
      "score": 0,
      "invalid": "workspace-unbound",
      "costUSD": 0.016728,
      "costBasis": "modeled",
      "wallTimeMs": 293113,
      "tokens": {
        "input": 17963,
        "output": 6567,
        "cacheRead": 358336,
        "cacheWrite": 0
      }
    }
  ]
}
