{
  "role": "fixer-worker",
  "suite": "micro",
  "generatedAt": "2026-09-18T20:42:21.684Z",
  "cells": [
    {
      "model": "glm-5.3-flash",
      "driver": "claude-agent",
      "runs": 5,
      "passed": 0,
      "total": 10,
      "score": 0,
      "invalid": "workspace-unbound",
      "costUSD": null,
      "wallTimeMs": 2825,
      "tokens": {
        "input": 0,
        "output": 0,
        "cacheRead": 0,
        "cacheWrite": 0
      }
    }
  ]
}
