{
  "role": "fixer-worker",
  "suite": "micro",
  "generatedAt": "2026-09-18T20:42:26.783Z",
  "cells": [
    {
      "model": "glm-5.3-flash",
      "driver": "subprocess",
      "runs": 5,
      "passed": 0,
      "total": 10,
      "score": 0,
      "costUSD": null,
      "wallTimeMs": 2682,
      "tokens": {
        "input": 0,
        "output": 0,
        "cacheRead": 0,
        "cacheWrite": 0
      }
    }
  ]
}
